
USB通讯：
	7bit地址(usb主机分配)+4bit端点(endpoint号，数据方向，以及端点类型)

USB的描述符：
	usb主机和0号设备的0号端点建立连接，通过发送命令获得设备的描述符；
	device/Configuration/Interface/Endpoint

	如果是多功能设备：
	Interface0: ep1, ep2, ep3
	Interface1: ep4, ep5, ep6



1. 设备描述符(每个设备一个)
==============================
Device Descriptor:
  bLength                18
  bDescriptorType         1
  bcdUSB               2.00
  bDeviceClass            0 (Defined at Interface level)
  bDeviceSubClass         0 
  bDeviceProtocol         0 
  bMaxPacketSize0        64
  idVendor           0x0781 SanDisk Corp.
  idProduct          0x5571 
  bcdDevice            1.26
  iManufacturer           1 SanDisk
  iProduct                2 Cruzer Fit
  iSerial                 3 4C532000000920101575
  bNumConfigurations      1


2.配置描述符(一个设备一个)
============================
Configuration Descriptor:
    bLength                 9
    bDescriptorType         2
    wTotalLength           32
    bNumInterfaces          1 //功能
    bConfigurationValue     1
    iConfiguration          0 
    bmAttributes         0x80
      (Bus Powered)
    MaxPower              200mA

3.接口描述符(每个功能一个)
==========================
    Interface Descriptor:
      bLength                 9
      bDescriptorType         4
      bInterfaceNumber        0
      bAlternateSetting       0
      bNumEndpoints           2
      bInterfaceClass         8 Mass Storage
      bInterfaceSubClass      6 SCSI
      bInterfaceProtocol     80 Bulk-Only
      iInterface              0 


4.端点描述符(每个接口会说明自己使用几个端点，每个端点有自己的描述符)
端点的信息包括：端点号(1~15)，端点的数据方向(IN/OUT)，端点的传输类型(Control/Bulk/Int)
==============================
Endpoint Descriptor:
        bLength                 7
        bDescriptorType         5
        bEndpointAddress     0x81  EP 1 IN (bit7:方向；bit[3-0]:端点号)
		1000,0001
        bmAttributes            2
          Transfer Type            Bulk
          Synch Type               None
          Usage Type               Data
        wMaxPacketSize     0x0200  1x 512 bytes
        bInterval               0

	存储设备的单元：sector(扇区)，大小512字节


    Endpoint Descriptor:
        bLength                 7
        bDescriptorType         5
        bEndpointAddress     0x02  EP 2 OUT
		0000,0010 
        bmAttributes            2
          Transfer Type            Bulk
          Synch Type               None
          Usage Type               Data
        wMaxPacketSize     0x0200  1x 512 bytes
        bInterval               1

Device Qualifier (for other device speed):
  bLength                10
  bDescriptorType         6
  bcdUSB               2.00
  bDeviceClass            0 (Defined at Interface level)
  bDeviceSubClass         0 
  bDeviceProtocol         0 
  bMaxPacketSize0        64
  bNumConfigurations      1
Device Status:     0x0000
  (Bus Powered)
